{"formatVersion":1,"providerId":"sqlserver","tables":[{"schema":"dbo","name":"Child","columns":[{"name":"Id","storeType":"INT","typeInference":"explicit","typeClass":"int32","nullable":false,"primaryKeyOrdinal":0,"generation":"identity","defaultExpression":null,"computedExpression":null,"concurrency":"none"},{"name":"ParentId","storeType":"INT","typeInference":"explicit","typeClass":"int32","nullable":false,"primaryKeyOrdinal":null,"generation":"none","defaultExpression":null,"computedExpression":null,"concurrency":"none"},{"name":"Code","storeType":"NVARCHAR(32)","typeInference":"explicit","typeClass":"string","nullable":false,"primaryKeyOrdinal":null,"generation":"default","defaultExpression":"'new'","computedExpression":null,"concurrency":"none"},{"name":"Total","storeType":null,"typeInference":"database","typeClass":"int32","nullable":true,"primaryKeyOrdinal":null,"generation":"computed","defaultExpression":null,"computedExpression":"Id + ParentId","concurrency":"none"},{"name":"Version","storeType":"ROWVERSION","typeInference":"explicit","typeClass":"bytearray","nullable":false,"primaryKeyOrdinal":null,"generation":"rowversion","defaultExpression":null,"computedExpression":null,"concurrency":"database"}],"primaryKey":["Id"],"indexes":[{"name":"IX_Child_Code","unique":true,"keyColumns":["Code"],"includeColumns":["ParentId"]}],"checks":[{"name":"CK_Child_Code","expression":"Code <> ''"}],"foreignKeys":[{"name":"FK_Child_Parent","localColumns":["ParentId"],"referencedSchema":"dbo","referencedTable":"Parent","referencedColumns":["Id"],"onDelete":"cascade","onUpdate":"no-action"}]},{"schema":"dbo","name":"Parent","columns":[{"name":"Id","storeType":"INT","typeInference":"explicit","typeClass":"int32","nullable":false,"primaryKeyOrdinal":0,"generation":"none","defaultExpression":null,"computedExpression":null,"concurrency":"none"}],"primaryKey":["Id"],"indexes":[],"checks":[],"foreignKeys":[]}],"providerArtifacts":[{"schema":"dbo","name":"Inquiry_Int32List","kind":"tvp","signature":"int32"}]}
